Title;Year;Description;Img
Casino;1995;"In early-1970s Las Vegas, Sam ""Ace"" Rothstein gets tapped by his bosses to head the Tangiers Casino. At first, he`s a great success in the job, but over the years, problems with his loose-cannon enforcer Nicky Santoro, his ex-hustler wife Ginger, her con-artist ex Lester Diamond and a handful of corrupt politicians put Sam in ever-increasing danger.";https://www.themoviedb.org/t/p/w600_and_h900_bestv2/6zEZY1htzRos2w0W3T7o7W1WJhp.jpg
The Truman Show;1998;Truman Burbank is the star of The Truman Show, a 24-hour-a-day reality TV show that broadcasts every aspect of his life without his knowledge. His entire life has been an unending soap opera for consumption by the rest of the world. And everyone he knows, including his wife and his best friend is really an actor, paid to be part of his life.;https://www.themoviedb.org/t/p/w600_and_h900_bestv2/vuza0WqY239yBXOadKlGwJsZJFE.jpg
There Will Be Blood;2007;Ruthless silver miner, turned oil prospector, Daniel Plainview, moves to oil-rich California. Using his son to project a trustworthy, family-man image, Plainview cons local landowners into selling him their valuable properties for a pittance. However, local preacher Eli Sunday suspects Plainview`s motives and intentions, starting a slow-burning feud that threatens both their lives.;https://www.themoviedb.org/t/p/w600_and_h900_bestv2/fa0RDkAlCec0STeMNAhPaF89q6U.jpg
Pan`s Labyrinth;2006;Living with her tyrannical stepfather in a new home with her pregnant mother, 10-year-old Ofelia feels alone until she explores a decaying labyrinth guarded by a mysterious faun who claims to know her destiny. If she wishes to return to her real father, Ofelia must complete three terrifying tasks.;https://www.themoviedb.org/t/p/w600_and_h900_bestv2/s8C4whhKtDaJvMDcyiMvx3BIF5F.jpg
Unforgiven;1992;William Munny is a retired, once-ruthless killer turned gentle widower and hog farmer. To help support his two motherless children, he accepts one last bounty-hunter mission to find the men who brutalized a prostitute. Joined by his former partner and a cocky greenhorn, he takes on a corrupt sheriff.;https://www.themoviedb.org/t/p/w600_and_h900_bestv2/yKyLJmRAtyXEEYKOvPhKHXIcPq9.jpg
The Sixth Sense;1999;Following an unexpected tragedy, child psychologist Malcolm Crowe meets a nine year old boy named Cole Sear, who is hiding a dark secret.;https://www.themoviedb.org/t/p/w600_and_h900_bestv2/4AfSDjjCy6T5LA1TMz0Lh2HlpRh.jpg
Shutter Island;2010;World War II soldier-turned-U.S. Marshal Teddy Daniels investigates the disappearance of a patient from a hospital for the criminally insane, but his efforts are compromised by troubling visions and a mysterious doctor.;https://www.themoviedb.org/t/p/w600_and_h900_bestv2/4GDy0PHYX3VRXUtwK5ysFbg3kEx.jpg
A Beautiful Mind;2001;John Nash is a brilliant but asocial mathematician fighting schizophrenia. After he accepts secret work in cryptography, his life takes a turn for the nightmarish.;https://www.themoviedb.org/t/p/w600_and_h900_bestv2/zwzWCmH72OSC9NA0ipoqw5Zjya8.jpg
Jurassic Park;1993;A wealthy entrepreneur secretly creates a theme park featuring living dinosaurs drawn from prehistoric DNA. Before opening day, he invites a team of experts and his two eager grandchildren to experience the park and help calm anxious investors. However, the park is anything but amusing as the security systems go off-line and the dinosaurs escape.;https://www.themoviedb.org/t/p/w600_and_h900_bestv2/oU7Oq2kFAAlGqbU4VoAE36g4hoI.jpg
Yojimbo;1961;A nameless ronin, or samurai with no master, enters a small village in feudal Japan where two rival businessmen are struggling for control of the local gambling trade. Taking the name Sanjuro Kuwabatake, the ronin convinces both silk merchant Tazaemon and sake merchant Tokuemon to hire him as a personal bodyguard, then artfully sets in motion a full-scale gang war between the two ambitious and unscrupulous men.;https://www.themoviedb.org/t/p/w600_and_h900_bestv2/tN7kYPjRhDolpui9sc9Eq9n5b2O.jpg
The Treasure of the Sierra Madre;1948;Fred C. Dobbs and Bob Curtin, both down on their luck in Tampico, Mexico in 1925, meet up with a grizzled prospector named Howard and decide to join with him in search of gold in the wilds of central Mexico. Through enormous difficulties, they eventually succeed in finding gold, but bandits, the elements, and most especially greed threaten to turn their success into disaster.;https://www.themoviedb.org/t/p/w600_and_h900_bestv2/pWcst7zVbi8Z8W6GFrdNE7HHRxL.jpg
Monty Python and the Holy Grail;1975;"King Arthur, accompanied by his squire, recruits his Knights of the Round Table, including Sir Bedevere the Wise, Sir Lancelot the Brave, Sir Robin the Not-Quite-So-Brave-As-Sir-Lancelot and Sir Galahad the Pure. On the way, Arthur battles the Black Knight who, despite having had all his limbs chopped off, insists he can still fight. They reach Camelot, but Arthur decides not  to enter, as ""it is a silly place"".";https://www.themoviedb.org/t/p/w600_and_h900_bestv2/xZ0rC0kuIsjk6RncpNK73kwstEP.jpg
No Country for Old Men;2007;Llewelyn Moss stumbles upon dead bodies, $2 million and a hoard of heroin in a Texas desert, but methodical killer Anton Chigurh comes looking for it, with local sheriff Ed Tom Bell hot on his trail. The roles of prey and predator blur as the violent pursuit of money and justice collide.;https://www.themoviedb.org/t/p/w600_and_h900_bestv2/bj1v6YKF8yHqA489VFfnQvOJpnc.jpg
Kill Bill: Vol. 1;2003;An assassin is shot by her ruthless employer, Bill, and other members of their assassination circle – but she lives to plot her vengeance.;https://www.themoviedb.org/t/p/w600_and_h900_bestv2/v7TaX8kXMXs5yFFGR41guUDNcnB.jpg
The Great Escape;1963;The Nazis, exasperated at the number of escapes from their prison camps by a relatively small number of Allied prisoners, relocate them to a high-security `escape-proof` camp to sit out the remainder of the war. Undaunted, the prisoners plan one of the most ambitious escape attempts of World War II. Based on a true story.;https://www.themoviedb.org/t/p/w600_and_h900_bestv2/gBH4H8UMFxl139HaLz6lRuvsel8.jpg
Rashomon;1950;Roman Porno from 1973.;https://www.themoviedb.org/t/p/w600_and_h900_bestv2/4HrdA8yAcZef8fw9qstzRz5NiLy.jpg
The Thing;1982;A team of American scientists investigate the empty, destroyed base of their Norwegian counterparts in Antarctica, only to discover a terrifying life force that can take the form of its prey.;https://www.themoviedb.org/t/p/w600_and_h900_bestv2/tzGY49kseSE9QAKk47uuDGwnSCu.jpg
Finding Nemo;2003;Nemo, an adventurous young clownfish, is unexpectedly taken from his Great Barrier Reef home to a dentist`s office aquarium. It`s up to his worrisome father Marlin and a friendly but forgetful fish Dory to bring Nemo home -- meeting vegetarian sharks, surfer dude turtles, hypnotic jellyfish, hungry seagulls, and more along the way.;https://www.themoviedb.org/t/p/w600_and_h900_bestv2/5lc6nQc0VhWFYFbNv016xze8Jvy.jpg
Spider-Man: No Way Home;2021;Peter Parker is unmasked and no longer able to separate his normal life from the high-stakes of being a super-hero. When he asks for help from Doctor Strange the stakes become even more dangerous, forcing him to discover what it truly means to be Spider-Man.;https://www.themoviedb.org/t/p/w600_and_h900_bestv2/uJYYizSuA9Y3DCs0qS4qWvHfZg4.jpg
The Elephant Man;1980;"A Victorian surgeon rescues a heavily disfigured man being mistreated by his ""owner"" as a side-show freak. Behind his monstrous façade, there is revealed a person of great intelligence and sensitivity. Based on the true story of Joseph Merrick (called John Merrick in the film), a severely deformed man in 19th century London.";https://www.themoviedb.org/t/p/w600_and_h900_bestv2/rk2lKgEtjF9HO9N2UFMRc2cMGdj.jpg
Chinatown;1974;Private eye Jake Gittes lives off of the murky moral climate of sunbaked, pre-World War II Southern California. Hired by a beautiful socialite to investigate her husband`s extra-marital affair, Gittes is swept into a maelstrom of double dealings and deadly deceits, uncovering a web of personal and political scandals that come crashing together.;https://www.themoviedb.org/t/p/w600_and_h900_bestv2/mQJz8J4naOA7RmCtypTPjgXZIMY.jpg
V for Vendetta;2005;In a world in which Great Britain has become a fascist state, a masked vigilante known only as “V” conducts guerrilla warfare against the oppressive British government. When V rescues a young woman from the secret police, he finds in her an ally with whom he can continue his fight to free the people of Britain.;https://www.themoviedb.org/t/p/w600_and_h900_bestv2/1avD1JeaRiJX5M4ahPdZPypGoGN.jpg
Raging Bull;1980;The life of boxer Jake LaMotta, whose violence and temper that led him to the top in the ring destroyed his life outside of it.;https://www.themoviedb.org/t/p/w600_and_h900_bestv2/rEviyDWNbAFmvvCPlkMRPAGUElG.jpg
Gone with the Wind;1939;The spoiled daughter of a Georgia plantation owner conducts a tumultuous romance with a cynical profiteer during the American Civil War and Reconstruction Era.;https://www.themoviedb.org/t/p/w600_and_h900_bestv2/lNz2Ow0wGCAvzckW7EOjE03KcYv.jpg
Dial M for Murder;1954;An ex-tennis pro carries out a plot to have his wife murdered after discovering she is having an affair, and assumes she will soon leave him for the other man anyway. When things go wrong, he improvises a new plan—to frame her for murder instead.;https://www.themoviedb.org/t/p/w600_and_h900_bestv2/2gDCAgl2iBQNuJuk6p2xtuS1ewg.jpg
Lock, Stock and Two Smoking Barrels;1998;A card shark and his unwillingly-enlisted friends need to make a lot of cash quick after losing a sketchy poker match. To do this they decide to pull a heist on a small-time gang who happen to be operating out of the flat next door.;https://www.themoviedb.org/t/p/w600_and_h900_bestv2/8kSerJrhrJWKLk1LViesGcnrUPE.jpg
Inside Out;2015;Growing up can be a bumpy road, and it`s no exception for Riley, who is uprooted from her Midwest life when her father starts a new job in San Francisco. Riley`s guiding emotions— Joy, Fear, Anger, Disgust and Sadness—live in Headquarters, the control centre inside Riley`s mind, where they help advise her through everyday life and tries to keep things positive, but the emotions conflict on how best to navigate a new city, house and school.;https://www.themoviedb.org/t/p/w600_and_h900_bestv2/2H1TmgdfNtsKlU9jKdeNyYL5y8T.jpg
Howl`s Moving Castle;2004;When Sophie, a shy young woman, is cursed with an old body by a spiteful witch, her only chance of breaking the spell lies with a self-indulgent yet insecure young wizard and his companions in his legged, walking castle.;https://www.themoviedb.org/t/p/w600_and_h900_bestv2/yeJ5Nj1k2NA0bBZjkZ10PvQKjTD.jpg
The Secret in Their Eyes;2009;A retired legal counselor writes a novel hoping to find closure for one of his past unresolved homicide cases and for his unreciprocated love with his superior - both of which still haunt him decades later.;https://www.themoviedb.org/t/p/w600_and_h900_bestv2/r3FctmAMk2tbrwxuWdpeLrZLwIz.jpg
Three Billboards Outside Ebbing, Missouri;2017;After seven months have passed without a culprit in her daughter`s murder case, Mildred Hayes makes a bold move, painting three signs leading into her town with a controversial message directed at Bill Willoughby, the town`s revered chief of police. When his second-in-command Officer Jason Dixon, an immature mother`s boy with a penchant for violence, gets involved, the battle between Mildred and Ebbing`s law enforcement is only exacerbated.;https://www.themoviedb.org/t/p/w600_and_h900_bestv2/pZRhqJj0DBy4ghB7g6pU7MGHsWJ.jpg
Trainspotting;1996;Heroin addict Mark Renton stumbles through bad ideas and sobriety attempts with his unreliable friends -- Sick Boy, Begbie, Spud and Tommy. He also has an underage girlfriend, Diane, along for the ride. After cleaning up and moving from Edinburgh to London, Mark finds he can`t escape the life he left behind when Begbie shows up at his front door on the lam, and a scheming Sick Boy follows.;https://www.themoviedb.org/t/p/w600_and_h900_bestv2/bhY62Dw8iW54DIhxPQerbuB9DOP.jpg
The Bridge on the River Kwai;1957;The classic story of English POWs in Burma forced to build a bridge to aid the war effort of their Japanese captors. British and American intelligence officers conspire to blow up the structure, but Col. Nicholson , the commander who supervised the bridge`s construction, has acquired a sense of pride in his creation and tries to foil their plans.;https://www.themoviedb.org/t/p/w600_and_h900_bestv2/7paXMt2e3Tr5dLmEZOGgFEn2Vo7.jpg
Prisoners;2013;Keller Dover faces a parent`s worst nightmare when his 6-year-old daughter, Anna, and her friend go missing. The only lead is an old motorhome that had been parked on their street. The head of the investigation, Detective Loki, arrests the driver, but a lack of evidence forces Loki to release his only suspect. Dover, knowing that his daughter`s life is at stake, decides that he has no choice but to take matters into his own hands.;https://www.themoviedb.org/t/p/w600_and_h900_bestv2/tuZhZ6biFMr5n9YSVuHOJnNL1uU.jpg
Warrior;2011;The youngest son of an alcoholic former boxer returns home, where he`s trained by his father for competition in a mixed martial arts tournament – a path that puts the fighter on a collision course with his estranged, older brother.;https://www.themoviedb.org/t/p/w600_and_h900_bestv2/iM8n4nZJPR2abpnyZ36FUgHiRjr.jpg
Fargo;1996;Jerry, a small-town Minnesota car salesman is bursting at the seams with debt... but he`s got a plan. He`s going to hire two thugs to kidnap his wife in a scheme to collect a hefty ransom from his wealthy father-in-law. It`s going to be a snap and nobody`s going to get hurt... until people start dying. Enter Police Chief Marge, a coffee-drinking, parka-wearing - and extremely pregnant - investigator who`ll stop at nothing to get her man. And if you think her small-time investigative skills will give the crooks a run for their ransom... you betcha!;https://www.themoviedb.org/t/p/w600_and_h900_bestv2/rt7cpEr1uP6RTZykBFhBTcRaKvG.jpg
Gran Torino;2008;Disgruntled Korean War veteran Walt Kowalski sets out to reform his neighbor, Thao Lor, a Hmong teenager who tried to steal Kowalski`s prized possession: a 1972 Gran Torino.;https://www.themoviedb.org/t/p/w600_and_h900_bestv2/zUybYvxWdAJy5hhYovsXtHSWI1l.jpg
Catch Me If You Can;2002;A true story about Frank Abagnale Jr. who, before his 19th birthday, successfully conned millions of dollars worth of checks as a Pan Am pilot, doctor, and legal prosecutor. An FBI agent makes it his mission to put him behind bars. But Frank not only eludes capture, he revels in the pursuit.;https://www.themoviedb.org/t/p/w600_and_h900_bestv2/sdYgEkKCDPWNU6KnoL4qd8xZ4w7.jpg
My Neighbor Totoro;1988;Two sisters move to the country with their father in order to be closer to their hospitalized mother, and discover the surrounding trees are inhabited by Totoros, magical spirits of the forest. When the youngest runs away from home, the older sister seeks help from the spirits to find her.;https://www.themoviedb.org/t/p/w600_and_h900_bestv2/rtGDOeG9LzoerkDGZF9dnVeLppL.jpg
Million Dollar Baby;2004;Despondent over a painful estrangement from his daughter, trainer Frankie Dunn isn`t prepared for boxer Maggie Fitzgerald to enter his life. But Maggie`s determined to go pro and to convince Dunn and his cohort to help her.;https://www.themoviedb.org/t/p/w600_and_h900_bestv2/2ti3l1OeB8G94yyqfAI7nmMZUbA.jpg
Children of Heaven;1997;"Zohre`s shoes are gone; her older brother Ali lost them. They are poor, there are no shoes for Zohre until they come up with an idea: they will share one pair of shoes. School awaits.";https://www.themoviedb.org/t/p/w600_and_h900_bestv2/jWqh1CJWAEcxckMRrf6ARhIEh0R.jpg
Blade Runner;1982;In the smog-choked dystopian Los Angeles of 2019, blade runner Rick Deckard is called out of retirement to terminate a quartet of replicants who have escaped to Earth seeking their creator for a way to extend their short life spans.;https://www.themoviedb.org/t/p/w600_and_h900_bestv2/63N9uy8nd9j7Eog2axPQ8lbr3Wj.jpg
The Gold Rush;1925;A gold prospector in Alaska struggles to survive the elements and win the heart of a dance hall girl.;https://www.themoviedb.org/t/p/w600_and_h900_bestv2/eQRFo1qwRREYwj47Yoe1PisgOle.jpg
Klaus;2019;When Jesper distinguishes himself as the Postal Academy`s worst student, he is sent to Smeerensburg, a small village located on an icy island above the Arctic Circle, where grumpy inhabitants barely exchange words, let alone letters. Jesper is about to give up and abandon his duty as a postman when he meets local teacher Alva and Klaus, a mysterious carpenter who lives alone in a cabin full of handmade toys.;https://www.themoviedb.org/t/p/w600_and_h900_bestv2/q125RHUDgR4gjwh1QkfYuJLYkL.jpg
Harry Potter and the Deathly Hallows: Part 2;2011;Harry, Ron and Hermione continue their quest to vanquish the evil Voldemort once and for all. Just as things begin to look hopeless for the young wizards, Harry discovers a trio of magical objects that endow him with powers to rival Voldemort`s formidable skills.;https://www.themoviedb.org/t/p/w600_and_h900_bestv2/c54HpQmuwXjHq2C9wmoACjxoom3.jpg
Before Sunrise;1995;A young man and woman meet on a train in Europe, and wind up spending one evening together in Vienna. Unfortunately, both know that this will probably be their only night together.;https://www.themoviedb.org/t/p/w600_and_h900_bestv2/kf1Jb1c2JAOqjuzA3H4oDM263uB.jpg
12 Years a Slave;2013;In the pre-Civil War United States, Solomon Northup, a free black man from upstate New York, is abducted and sold into slavery. Facing cruelty as well as unexpected kindnesses Solomon struggles not only to stay alive, but to retain his dignity. In the twelfth year of his unforgettable odyssey, Solomon’s chance meeting with a Canadian abolitionist will forever alter his life.;https://www.themoviedb.org/t/p/w600_and_h900_bestv2/xdANQijuNrJaw1HA61rDccME4Tm.jpg
Ben-Hur;1959;In 25 AD, Judah Ben-Hur, a Jew in ancient Judea, opposes the occupying Roman empire.  Falsely accused by a Roman childhood friend-turned-overlord of trying to kill the Roman governor, he is put into slavery and his mother and sister are taken away as prisoners.  Three years later and freed by a grateful Roman galley commander whom he has rescued from drowning, he becomes an expert charioteer for Rome, all the while plotting to return to Judea, find and rescue his family, and avenge himself on his former friend.  All the while, the form and work of Jesus move in the background of his life...;https://www.themoviedb.org/t/p/w600_and_h900_bestv2/m4WQ1dBIrEIHZNCoAjdpxwSKWyH.jpg
The Grand Budapest Hotel;2014;The Grand Budapest Hotel tells of a legendary concierge at a famous European hotel between the wars and his friendship with a young employee who becomes his trusted protégé. The story involves the theft and recovery of a priceless Renaissance painting, the battle for an enormous family fortune and the slow and then sudden upheavals that transformed Europe during the first half of the 20th century.;https://www.themoviedb.org/t/p/w600_and_h900_bestv2/eWdyYQreja6JGCzqHWXpWHDrrPo.jpg
On the Waterfront;1954;Terry Malloy dreams about being a prize fighter, while tending his pigeons and running errands at the docks for Johnny Friendly, the corrupt boss of the dockers union. Terry witnesses a murder by two of Johnny`s thugs, and later meets the dead man`s sister and feels responsible for his death. She introduces him to Father Barry, who tries to force him to provide information for the courts that will smash the dock racketeers.;https://www.themoviedb.org/t/p/w600_and_h900_bestv2/fKjLZy9W8VxMOp5OoyWojmLVCQw.jpg
Gone Girl;2014;With his wife`s disappearance having become the focus of an intense media circus, a man sees the spotlight turned on him when it`s suspected that he may not be innocent.;https://www.themoviedb.org/t/p/w600_and_h900_bestv2/qymaJhucquUwjpb8oiqynMeXnID.jpg
Wild Strawberries;1957;Crotchety retired doctor Isak Borg travels from Stockholm to Lund, Sweden, with his pregnant and unhappy daughter-in-law, Marianne, in order to receive an honorary degree from his alma mater. Along the way, they encounter a series of hitchhikers, each of whom causes the elderly doctor to muse upon the pleasures and failures of his own life. These include the vivacious young Sara, a dead ringer for the doctor`s own first love.;https://www.themoviedb.org/t/p/w600_and_h900_bestv2/iyTD2QnySNMPUPE3IedZQipSWfz.jpg
The General;1926;During America’s Civil War, Union spies steal engineer Johnnie Gray`s beloved locomotive, `The General`—with Johnnie`s lady love aboard an attached boxcar—and he single-handedly must do all in his power to both get The General back and to rescue Annabelle.;https://www.themoviedb.org/t/p/w600_and_h900_bestv2/iaV7LKAEialeaKDtf22SrYMqeFC.jpg
Barry Lyndon;1975;An Irish rogue uses his cunning and wit to work his way up the social classes of 18th century England, transforming himself from the humble Redmond Barry into the noble Barry Lyndon.;https://www.themoviedb.org/t/p/w600_and_h900_bestv2/3YJEv83HWWgCKezTiQ9LhdR7cFU.jpg
John Wick: Chapter 4;2023;With the price on his head ever increasing, John Wick uncovers a path to defeating The High Table. But before he can earn his freedom, Wick must face off against a new enemy with powerful alliances across the globe and forces that turn old friends into foes.;https://www.themoviedb.org/t/p/w600_and_h900_bestv2/vZloFAK7NmvMGKE7VkF5UHaz0I.jpg
In the Name of the Father;1993;A small time thief from Belfast, Gerry Conlon, is falsely implicated in the IRA bombing of a pub that kills several people while he is in London. He and his four friends are coerced by British police into confessing their guilt. Gerry`s father and other relatives in London are also implicated in the crime. He spends fifteen years in prison with his father trying to prove his innocence.;https://www.themoviedb.org/t/p/w600_and_h900_bestv2/5HaQacOMOjA2wX1XnwnDd2VaXCf.jpg
The Deer Hunter;1978;A group of working-class friends decide to enlist in the Army during the Vietnam War and finds it to be hellish chaos -- not the noble venture they imagined. Before they left, Steven married his pregnant girlfriend -- and Michael and Nick were in love with the same woman. But all three are different men upon their return.;https://www.themoviedb.org/t/p/w600_and_h900_bestv2/bbGtogDZOg09bm42KIpCXUXICkh.jpg
Hacksaw Ridge;2016;WWII American Army Medic Desmond T. Doss, who served during the Battle of Okinawa, refuses to kill people and becomes the first Conscientious Objector in American history to receive the Congressional Medal of Honor.;https://www.themoviedb.org/t/p/w600_and_h900_bestv2/jhWbYeUNOA5zAb6ufK6pXQFXqTX.jpg
The Third Man;1949;"In postwar Vienna, Austria, Holly Martins, a writer of pulp Westerns, arrives penniless as a guest of his childhood chum Harry Lime, only to learn he has died. Martins develops a conspiracy theory after learning of a ""third man"" present at the time of Harry`s death, running into interference from British officer Major Calloway, and falling head-over-heels for Harry`s grief-stricken lover, Anna.";https://www.themoviedb.org/t/p/w600_and_h900_bestv2/oIF3l7Dxp7Eyye10BNyM611wtKa.jpg
The Wages of Fear;1953;In a run-down South American town, four men are paid to drive trucks loaded with nitroglycerin into the jungle through to the oil field. Friendships are tested and rivalries develop as they embark upon the perilous journey.;https://www.themoviedb.org/t/p/w600_and_h900_bestv2/dZyZSosIlWcpQkV0f7pXcrV2TQV.jpg
Memories of Murder;2003;During the late 1980s, two detectives in a South Korean province attempt to solve the nation`s first series of rape-and-murder cases.;https://www.themoviedb.org/t/p/w600_and_h900_bestv2/jcgUjx1QcupGzjntTVlnQ15lHqy.jpg
Wild Tales;2014;Six deadly stories that explore the extremities of human behaviour involving distressed people seeking revenge.;https://www.themoviedb.org/t/p/w600_and_h900_bestv2/pvSty5MCAxdj8LlAEXCDfM1YNOl.jpg
Sherlock Jr.;1924;A film projectionist longs to be a detective, and puts his meagre skills to work when he is framed by a rival for stealing his girlfriend`s father`s pocketwatch.;https://www.themoviedb.org/t/p/w600_and_h900_bestv2/1G9r3rqtbFAQuyWKOZm4Y5J5s7Q.jpg
Mr. Smith Goes to Washington;1939;Naive and idealistic Jefferson Smith, leader of the Boy Rangers, is appointed to the United States Senate by the puppet governor of his state. He soon discovers, upon going to Washington, many shortcomings of the political process as his earnest goal of a national boys` camp leads to a conflict with the state political boss.;https://www.themoviedb.org/t/p/w600_and_h900_bestv2/nDjg1fbNyq15excNDl3acd2IqAk.jpg
Mad Max: Fury Road;2015;An apocalyptic story set in the furthest reaches of our planet, in a stark desert landscape where humanity is broken, and most everyone is crazed fighting for the necessities of life. Within this world exist two rebels on the run who just might be able to restore order.;https://www.themoviedb.org/t/p/w600_and_h900_bestv2/8tZYtuWezp8JbcsvHYO0O46tFbo.jpg
Mary and Max;2009;A tale of friendship between two unlikely pen pals: Mary, a lonely, eight-year-old girl living in the suburbs of Melbourne, and Max, a forty-four-year old, severely obese man living in New York.;https://www.themoviedb.org/t/p/w600_and_h900_bestv2/b4LKlquh0ls5Rgb27QLPlkC7Oya.jpg
