Title;Year;Description;Img
The Shawshank Redemption;1994;Framed in the 1940s for the double murder of his wife and her lover, upstanding banker Andy Dufresne begins a new life at the Shawshank prison, where he puts his accounting skills to work for an amoral warden. During his long stretch in prison, Dufresne comes to be admired by the other inmates -- including an older prisoner named Red -- for his integrity and unquenchable sense of hope.;https://www.themoviedb.org/t/p/w600_and_h900_bestv2/q6y0Go1tsGEsmtFryDOJo3dEmqu.jpg
The Godfather;1972;Spanning the years 1945 to 1955, a chronicle of the fictional Italian-American Corleone crime family. When organized crime family patriarch, Vito Corleone barely survives an attempt on his life, his youngest son, Michael steps in to take care of the would-be killers, launching a campaign of bloody revenge.;https://www.themoviedb.org/t/p/w600_and_h900_bestv2/3bhkrj58Vtu7enYsRolD1fZdja1.jpg
The Dark Knight;2008;Batman raises the stakes in his war on crime. With the help of Lt. Jim Gordon and District Attorney Harvey Dent, Batman sets out to dismantle the remaining criminal organizations that plague the streets. The partnership proves to be effective, but they soon find themselves prey to a reign of chaos unleashed by a rising criminal mastermind known to the terrified citizens of Gotham as the Joker.;https://www.themoviedb.org/t/p/w600_and_h900_bestv2/qJ2tW6WMUDux911r6m7haRef0WH.jpg
The Godfather Part II;1974;In the continuing saga of the Corleone crime family, a young Vito Corleone grows up in Sicily and in 1910s New York. In the 1950s, Michael Corleone attempts to expand the family business into Las Vegas, Hollywood and Cuba.;https://www.themoviedb.org/t/p/w600_and_h900_bestv2/hek3koDUyRQk7FIhPXsa6mT2Zc3.jpg
12 Angry Men;1957;The defense and the prosecution have rested and the jury is filing into the jury room to decide if a young Spanish-American is guilty or innocent of murdering his father. What begins as an open and shut case soon becomes a mini-drama of each of the jurors` prejudices and preconceptions about the trial, the accused, and each other.;https://www.themoviedb.org/t/p/w600_and_h900_bestv2/ow3wq89wM8qd5X7hWKxiRfsFf9C.jpg
Schindler`s List;1993;The true story of how businessman Oskar Schindler saved over a thousand Jewish lives from the Nazis while they worked as slaves in his factory during World War II.;https://www.themoviedb.org/t/p/w600_and_h900_bestv2/sF1U4EUQS8YHUYjNl3pMGNIQyr0.jpg
The Lord of the Rings: The Return of the King;2003;Aragorn is revealed as the heir to the ancient kings as he, Gandalf and the other members of the broken fellowship struggle to save Gondor from Sauron`s forces. Meanwhile, Frodo and Sam take the ring closer to the heart of Mordor, the dark lord`s realm.;https://www.themoviedb.org/t/p/w600_and_h900_bestv2/rCzpDGLbOoPwLjy3OAm5NUPOTrC.jpg
Pulp Fiction;1994;A burger-loving hit man, his philosophical partner, a drug-addled gangster`s moll and a washed-up boxer converge in this sprawling, comedic crime caper. Their adventures unfurl in three stories that ingeniously trip back and forth in time.;https://www.themoviedb.org/t/p/w600_and_h900_bestv2/d5iIlFn5s0ImszYzBPb8JPIfbXD.jpg
The Lord of the Rings: The Fellowship of the Ring;2001;Young hobbit Frodo Baggins, after inheriting a mysterious ring from his uncle Bilbo, must leave his home in order to keep it from falling into the hands of its evil creator. Along the way, a fellowship is formed to protect the ringbearer and make sure that the ring arrives at its final destination: Mt. Doom, the only place where it can be destroyed.;https://www.themoviedb.org/t/p/w600_and_h900_bestv2/6oom5QYQ2yQTMJIbnvbkBL9cHo6.jpg
The Good, the Bad and the Ugly;1966;While the Civil War rages on between the Union and the Confederacy, three men – a quiet loner, a ruthless hitman, and a Mexican bandit – comb the American Southwest in search of a strongbox containing $200,000 in stolen gold.;https://www.themoviedb.org/t/p/w600_and_h900_bestv2/bX2xnavhMYjWDoZp1VM6VnU1xwe.jpg
Forrest Gump;1994;A man with a low IQ has accomplished great things in his life and been present during significant historic events—in each case, far exceeding what anyone imagined he could do. But despite all he has achieved, his one true love eludes him.;https://www.themoviedb.org/t/p/w600_and_h900_bestv2/arw2vcBveWOVZr6pxd9XTd1TdQa.jpg
Fight Club;1999;"A ticking-time-bomb insomniac and a slippery soap salesman channel primal male aggression into a shocking new form of therapy. Their concept catches on, with underground ""fight clubs"" forming in every town, until an eccentric gets in the way and ignites an out-of-control spiral toward oblivion.";https://www.themoviedb.org/t/p/w600_and_h900_bestv2/pB8BM7pdSp6B6Ih7QZ4DrQ3PmJK.jpg
The Lord of the Rings: The Two Towers;2002;Frodo and Sam are trekking to Mordor to destroy the One Ring of Power while Gimli, Legolas and Aragorn search for the orc-captured Merry and Pippin. All along, nefarious wizard Saruman awaits the Fellowship members at the Orthanc Tower in Isengard.;https://www.themoviedb.org/t/p/w600_and_h900_bestv2/5VTN0pR8gcqV3EPUHHfMGnJYN9L.jpg
Inception;2010;"Cobb, a skilled thief who commits corporate espionage by infiltrating the subconscious of his targets is offered a chance to regain his old life as payment for a task considered to be impossible: ""inception"", the implantation of another person`s idea into a target`s subconscious.";https://www.themoviedb.org/t/p/w600_and_h900_bestv2/edv5CZvWj09upOsy2Y6IwDhK8bt.jpg
Star Wars: Episode V - The Empire Strikes Back;1980;The epic saga continues as Luke Skywalker, in hopes of defeating the evil Galactic Empire, learns the ways of the Jedi from aging master Yoda. But Darth Vader is more determined than ever to capture Luke. Meanwhile, rebel leader Princess Leia, cocky Han Solo, Chewbacca, and droids C-3PO and R2-D2 are thrown into various stages of capture, betrayal and despair.;https://www.themoviedb.org/t/p/w600_and_h900_bestv2/2l05cFWJacyIsTpsqSgH0wQXe4V.jpg
The Matrix;1999;Set in the 22nd century, The Matrix tells the story of a computer hacker who joins a group of underground insurgents fighting the vast and powerful computers who now rule the earth.;https://www.themoviedb.org/t/p/w600_and_h900_bestv2/f89U3ADr1oiB1s9GkdPOEpXUk5H.jpg
Goodfellas;1990;The true story of Henry Hill, a half-Irish, half-Sicilian Brooklyn kid who is adopted by neighbourhood gangsters at an early age and climbs the ranks of a Mafia family under the guidance of Jimmy Conway.;https://www.themoviedb.org/t/p/w600_and_h900_bestv2/aKuFiU82s5ISJpGZp7YkIr3kCUd.jpg
One Flew Over the Cuckoo`s Nest;1975;A petty criminal fakes insanity to serve his sentence in a mental ward rather than prison. He soon finds himself as a leader to the other patients—and an enemy to the cruel, domineering nurse who runs the ward.;https://www.themoviedb.org/t/p/w600_and_h900_bestv2/3jcbDmRFiQ83drXNOvRDeKHxS0C.jpg
Se7en;1995;"Two homicide detectives are on a desperate hunt for a serial killer whose crimes are based on the ""seven deadly sins"" in this dark and haunting film that takes viewers from the tortured remains of one victim to the next. The seasoned Det. Sommerset researches each sin in an effort to get inside the killer`s mind, while his novice partner, Mills, scoffs at his efforts to unravel the case.";https://www.themoviedb.org/t/p/w600_and_h900_bestv2/6yoghtyTpznpBik8EngEmJskVUO.jpg
It`s a Wonderful Life;1946;A holiday favourite for generations...  George Bailey has spent his entire life giving to the people of Bedford Falls.  All that prevents rich skinflint Mr. Potter from taking over the entire town is George`s modest building and loan company.  But on Christmas Eve the business`s $8,000 is lost and George`s troubles begin.;https://www.themoviedb.org/t/p/w600_and_h900_bestv2/mV3VcmMJN6Zwahj42dy9WwPUyRI.jpg
Seven Samurai;1954;A samurai answers a village`s request for protection after he falls on hard times. The town needs protection from bandits, so the samurai gathers six others to help him teach the people how to defend themselves, and the villagers provide the soldiers with food.;https://www.themoviedb.org/t/p/w600_and_h900_bestv2/8OKmBV5BUFzmozIC3pPWKHy17kx.jpg
The Silence of the Lambs;1991;Clarice Starling is a top student at the FBI`s training academy.  Jack Crawford wants Clarice to interview Dr. Hannibal Lecter, a brilliant psychiatrist who is also a violent psychopath, serving life behind bars for various acts of murder and cannibalism.  Crawford believes that Lecter may have insight into a case and that Starling, as an attractive young woman, may be just the bait to draw him out.;https://www.themoviedb.org/t/p/w600_and_h900_bestv2/uS9m8OBk1A8eM9I042bx8XXpqAq.jpg
Saving Private Ryan;1998;As U.S. troops storm the beaches of Normandy, three brothers lie dead on the battlefield, with a fourth trapped behind enemy lines. Ranger captain John Miller and seven men are tasked with penetrating German-held territory and bringing the boy home.;https://www.themoviedb.org/t/p/w600_and_h900_bestv2/uqx37cS8cpHg8U35f9U5IBlrCV3.jpg
City of God;2002;In the slums of Rio, two kids` paths diverge as one struggles to become a photographer and the other a kingpin.;https://www.themoviedb.org/t/p/w600_and_h900_bestv2/k7eYdWvhYQyRQoU2TB2A2Xu2TfD.jpg
Interstellar;2014;The adventures of a group of explorers who make use of a newly discovered wormhole to surpass the limitations on human space travel and conquer the vast distances involved in an interstellar voyage.;https://www.themoviedb.org/t/p/w600_and_h900_bestv2/gEU2QniE6E77NI6lCU6MxlNBvIx.jpg
Life Is Beautiful;1997;A touching story of an Italian book seller of Jewish ancestry who lives in his own little fairy tale. His creative and happy life would come to an abrupt halt when his entire family is deported to a concentration camp during World War II. While locked up he tries to convince his son that the whole thing is just a game.;https://www.themoviedb.org/t/p/w600_and_h900_bestv2/mfnkSeeVOBVheuyn2lo4tfmOPQb.jpg
The Green Mile;1999;A supernatural tale set on death row in a Southern prison, where gentle giant John Coffey possesses the mysterious power to heal people`s ailments. When the cell block`s head guard, Paul Edgecomb, recognizes Coffey`s miraculous gift, he tries desperately to help stave off the condemned man`s execution.;https://www.themoviedb.org/t/p/w600_and_h900_bestv2/o0lO84GI7qrG6XFvtsPOSV7CTNa.jpg
Star Wars;1977;Princess Leia is captured and held hostage by the evil Imperial forces in their effort to take over the galactic Empire. Venturesome Luke Skywalker and dashing captain Han Solo team together with the loveable robot duo R2-D2 and C-3PO to rescue the beautiful princess and restore peace and justice in the Empire.;https://www.themoviedb.org/t/p/w600_and_h900_bestv2/6FfCtAuVAW8XJjZ7eWeLibRLWTw.jpg
Terminator 2: Judgment Day;1991;Nearly 10 years have passed since Sarah Connor was targeted for termination by a cyborg from the future. Now her son, John, the future leader of the resistance, is the target for a newer, more deadly terminator. Once again, the resistance has managed to send a protector back to attempt to save John and his mother Sarah.;https://www.themoviedb.org/t/p/w600_and_h900_bestv2/5M0j0B18abtBI5gi2RhfjjurTqb.jpg
Back to the Future;1985;Eighties teenager Marty McFly is accidentally sent back in time to 1955, inadvertently disrupting his parents` first meeting and attracting his mother`s romantic interest. Marty must repair the damage to history by rekindling his parents` romance and - with the help of his eccentric inventor friend Doc Brown - return to 1985.;https://www.themoviedb.org/t/p/w600_and_h900_bestv2/fNOH9f1aA7XRTzl1sAOx9iF553Q.jpg
Spirited Away;2001;A young girl, Chihiro, becomes trapped in a strange new world of spirits. When her parents undergo a mysterious transformation, she must call upon the courage she never knew she had to free her family.;https://www.themoviedb.org/t/p/w600_and_h900_bestv2/39wmItIWsg5sZMyRUHLkWBcuVCM.jpg
The Pianist;2002;"The true story of pianist Wladyslaw Szpilman`s experiences in Warsaw during the Nazi occupation. When the Jews of the city find themselves forced into a ghetto, Szpilman finds work playing in a café; and when his family is deported in 1942, he stays behind, works for a while as a laborer, and eventually goes into hiding in the ruins of the war-torn city.";https://www.themoviedb.org/t/p/w600_and_h900_bestv2/2hFvxCCWrTmCYwfy7yum0GKRi3Y.jpg
Psycho;1960;When larcenous real estate clerk Marion Crane goes on the lam with a wad of cash and hopes of starting a new life, she ends up at the notorious Bates Motel, where manager Norman Bates cares for his housebound mother.;https://www.themoviedb.org/t/p/w600_and_h900_bestv2/yz4QVqPx3h1hD1DfqqQkCq3rmxW.jpg
Parasite;2019;Paul Dean has created a deadly parasite that is now attached to his stomach. He and his female companion, Patricia Welles, must find a way to destroy it while also trying to avoid Ricus, his rednecks, and an evil government agent named Merchant.;https://www.themoviedb.org/t/p/w600_and_h900_bestv2/6EM7Jm3veKSW9ELMajSSxslYWDa.jpg
Léon: The Professional;1994;"Léon, the top hit man in New York, has earned a rep as an effective ""cleaner"". But when his next-door neighbors are wiped out by a loose-cannon DEA agent, he becomes the unwilling custodian of 12-year-old Mathilda. Before long, Mathilda`s thoughts turn to revenge, and she considers following in Léon`s footsteps.";https://www.themoviedb.org/t/p/w600_and_h900_bestv2/yI6X2cCM5YPJtxMhUd3dPGqDAhw.jpg
The Lion King;1994;A young lion prince is cast out of his pride by his cruel uncle, who claims he killed his father. While the uncle rules with an iron paw, the prince grows up beyond the Savannah, living by a philosophy: No worries for the rest of your days. But when his past comes to haunt him, the young prince must decide his fate: Will he remain an outcast or face his demons and become what he needs to be?;https://www.themoviedb.org/t/p/w600_and_h900_bestv2/sKCr78MXSLixwmZ8DyJLrpMsd15.jpg
Gladiator;2000;In the year 180, the death of emperor Marcus Aurelius throws the Roman Empire into chaos.  Maximus is one of the Roman army`s most capable and trusted generals and a key advisor to the emperor.  As Marcus` devious son Commodus ascends to the throne, Maximus is set to be executed.  He escapes, but is captured by slave traders.  Renamed Spaniard and forced to become a gladiator, Maximus must battle to the death with other men for the amusement of paying audiences.;https://www.themoviedb.org/t/p/w600_and_h900_bestv2/ty8TGRuvJLPUmAR1H1nRIsgwvim.jpg
American History X;1998;Derek Vineyard is paroled after serving 3 years in prison for killing two African-American men. Through his brother, Danny Vineyard`s narration, we learn that before going to prison, Derek was a skinhead and the leader of a violent white supremacist gang that committed acts of racial crime throughout L.A. and his actions greatly influenced Danny. Reformed and fresh out of prison, Derek severs contact with the gang and becomes determined to keep Danny from going down the same violent path as he did.;https://www.themoviedb.org/t/p/w600_and_h900_bestv2/c2gsmSQ2Cqv8zosqKOCwRS0GFBS.jpg
The Departed;2006;To take down South Boston`s Irish Mafia, the police send in one of their own to infiltrate the underworld, not realizing the syndicate has done likewise. While an undercover cop curries favor with the mob kingpin, a career criminal rises through the police ranks. But both sides soon discover there`s a mole among them.;https://www.themoviedb.org/t/p/w600_and_h900_bestv2/nT97ifVT2J1yMQmeq20Qblg61T.jpg
Whiplash;2014;Under the direction of a ruthless instructor, a talented young drummer begins to pursue perfection at any cost, even his humanity.;https://www.themoviedb.org/t/p/w600_and_h900_bestv2/7fn624j5lj3xTme2SgiLCeuedmO.jpg
The Prestige;2006;A mysterious story of two magicians whose intense rivalry leads them on a life-long battle for supremacy -- full of obsession, deceit and jealousy with dangerous and deadly consequences.;https://www.themoviedb.org/t/p/w600_and_h900_bestv2/bdN3gXuIZYaJP7ftKK2sU0nPtEA.jpg
The Usual Suspects;1995;Held in an L.A. interrogation room, Verbal Kint attempts to convince the feds that a mythic crime lord, Keyser Soze, not only exists, but was also responsible for drawing him and his four partners into a multi-million dollar heist that ended with an explosion in San Pedro harbor – leaving few survivors. Verbal lures his interrogators with an incredible story of the crime lord`s almost supernatural prowess.;https://www.themoviedb.org/t/p/w600_and_h900_bestv2/bUPmtQzrRhzqYySeiMpv7GurAfm.jpg
Casablanca;1942;In Casablanca, Morocco in December 1941, a cynical American expatriate meets a former lover, with unforeseen complications.;https://www.themoviedb.org/t/p/w600_and_h900_bestv2/5K7cOHoay2mZusSLezBOY0Qxh8a.jpg
Grave of the Fireflies;1988;Hisako loses her home in Tokyo to Allied bombing. With her husband fighting somewhere in Asia, she and her two children evacuate to a suburb of Kobe, where they share a house with Hisako`s cousin, Kyoko. Kobe is bombed and Kyoko is killed. Hisako is forced to take care of Kyoko`s two children in addition to her own, but there is not enough food for everyone.;https://www.themoviedb.org/t/p/w600_and_h900_bestv2/im6u58cPa9HlH5DqSnZGy0O37l5.jpg
Harakiri;1962;The daughter of a Daimyo, one forced to commit harakiri to secure her a future to choose her own destiny, falls in love with and marries a European officer. The officer returns to Europe but promises to come back for her and his new child, but when he comes back to Japan, he brings his European wife.;https://www.themoviedb.org/t/p/w600_and_h900_bestv2/xDXMUdERs3uFtgO8P5J5WyWT554.jpg
The Intouchables;2011;A true story of two men who should never have met – a quadriplegic aristocrat who was injured in a paragliding accident and a young man from the projects.;https://www.themoviedb.org/t/p/w600_and_h900_bestv2/323BP0itpxTsO0skTwdnVmf7YC9.jpg
Modern Times;1936;The Tramp struggles to live in modern industrial society with the help of a young homeless woman.;https://www.themoviedb.org/t/p/w600_and_h900_bestv2/smggAeGHRjKy85h6BzF0eTeDrFW.jpg
Once Upon a Time in the West;1968;As the railroad builders advance unstoppably through the Arizona desert on their way to the sea, Jill arrives in the small town of Flagstone with the intention of starting a new life.;https://www.themoviedb.org/t/p/w600_and_h900_bestv2/qbYgqOczabWNn2XKwgMtVrntD6P.jpg
Cinema Paradiso;1988;A filmmaker recalls his childhood, when he fell in love with the movies at his village`s theater and formed a deep friendship with the theater`s projectionist.;https://www.themoviedb.org/t/p/w600_and_h900_bestv2/8SRUfRUi6x4O68n0VCbDNRa6iGL.jpg
Rear Window;1954;A wheelchair-bound photographer spies on his neighbors from his apartment window and becomes convinced one of them has committed murder.;https://www.themoviedb.org/t/p/w600_and_h900_bestv2/qitnZcLP7C9DLRuPpmvZ7GiEjJN.jpg
Alien;1979;During its return to the earth, commercial spaceship Nostromo intercepts a distress signal from a distant planet. When a three-member team of the crew discovers a chamber containing thousands of eggs on the planet, a creature inside one of the eggs attacks an explorer. The entire crew is unaware of the impending nightmare set to descend upon them when the alien parasite planted inside its unfortunate host is birthed.;https://www.themoviedb.org/t/p/w600_and_h900_bestv2/vfrQk5IPloGg1v9Rzbh2Eg3VGyM.jpg
City Lights;1931;In this sound-era silent film, a tramp falls in love with a beautiful blind flower seller.;https://www.themoviedb.org/t/p/w600_and_h900_bestv2/bXNvzjULc9jrOVhGfjcc64uKZmZ.jpg
Apocalypse Now;1979;"At the height of the Vietnam war, Captain Benjamin Willard is sent on a dangerous mission that, officially, ""does not exist, nor will it ever exist."" His goal is to locate - and eliminate - a mysterious Green Beret Colonel named Walter Kurtz, who has been leading his personal army on illegal guerrilla missions into enemy territory.";https://www.themoviedb.org/t/p/w600_and_h900_bestv2/gQB8Y5RCMkv2zwzFHbUJX3kAhvA.jpg
Memento;2000;Leonard Shelby is tracking down the man who raped and murdered his wife. The difficulty of locating his wife`s killer, however, is compounded by the fact that he suffers from a rare, untreatable form of short-term memory loss. Although he can recall details of life before his accident, Leonard cannot remember what happened fifteen minutes ago, where he`s going, or why.;https://www.themoviedb.org/t/p/w600_and_h900_bestv2/yuNs09hvpHVU1cBTCAk9zxsL2oW.jpg
Django Unchained;2012;With the help of a German bounty hunter, a freed slave sets out to rescue his wife from a brutal Mississippi plantation owner.;https://www.themoviedb.org/t/p/w600_and_h900_bestv2/7oWY8VDWW7thTzWh3OKYRkWUlD5.jpg
Raiders of the Lost Ark;1981;When Dr. Indiana Jones – the tweed-suited professor who just happens to be a celebrated archaeologist – is hired by the government to locate the legendary Ark of the Covenant, he finds himself up against the entire Nazi regime.;https://www.themoviedb.org/t/p/w600_and_h900_bestv2/ceG9VzoRAVGwivFU403Wc3AHRys.jpg
WALL·E;2008;WALL·E is the last robot left on an Earth that has been overrun with garbage and all humans have fled to outer space. For 700 years he has continued to try and clean up the mess, but has developed some rather interesting human-like qualities. When a ship arrives with a sleek new type of robot, WALL·E thinks he`s finally found a friend and stows away on the ship when it leaves.;https://www.themoviedb.org/t/p/w600_and_h900_bestv2/Agc6lw8pb6BIGVeguvdjDT0p9Mb.jpg
The Lives of Others;2006;In 1984 East Berlin, an agent of the secret police, conducting surveillance on a writer and his lover, finds himself becoming increasingly absorbed by their lives.;https://www.themoviedb.org/t/p/w600_and_h900_bestv2/pUKnhEQvQJI7SAIMbDsmrXUAMVE.jpg
Sunset Blvd.;1950;"Commissioned by The Getty Museum on the occasion of their 2019 Getty Medal to the painter, draftsman, photographer, and bookmaker, Ed Ruscha. Utilizing The Getty Research Institute`s preservation and digitization of over a million images from Ed`s Streets of Los Angeles photo series, and excerpts from Jack Kerouac`s ""On The Road,"" this film puts together two of Ed`s major inspirations: Kerouac`s text and the city of Los Angeles.";https://www.themoviedb.org/t/p/w600_and_h900_bestv2/i355u6490I0vsNrvORwfp0qvoqw.jpg
Paths of Glory;1957;A commanding officer defends three scapegoats on trial for a failed offensive that occurred within the French Army in 1916.;https://www.themoviedb.org/t/p/w600_and_h900_bestv2/l2IY0gOHHmCWM90LjteFssxIV1G.jpg
The Shining;1980;Jack Torrance accepts a caretaker job at the Overlook Hotel, where he, along with his wife Wendy and their son Danny, must live isolated from the rest of the world for the winter. But they aren`t prepared for the madness that lurks within.;https://www.themoviedb.org/t/p/w600_and_h900_bestv2/nRj5511mZdTl4saWEPoj9QroTIu.jpg
The Great Dictator;1940;Dictator Adenoid Hynkel tries to expand his empire while a poor Jewish barber tries to avoid persecution from Hynkel`s regime.;https://www.themoviedb.org/t/p/w600_and_h900_bestv2/1QpO9wo7JWecZ4NiBuu625FiY1j.jpg
Avengers: Infinity War;2018;As the Avengers and their allies have continued to protect the world from threats too large for any one hero to handle, a new danger has emerged from the cosmic shadows: Thanos. A despot of intergalactic infamy, his goal is to collect all six Infinity Stones, artifacts of unimaginable power, and use them to inflict his twisted will on all of reality. Everything the Avengers have fought for has led up to this moment - the fate of Earth and existence itself has never been more uncertain.;https://www.themoviedb.org/t/p/w600_and_h900_bestv2/7WsyChQLEftFiDOVTGkv3hFpyyt.jpg
Witness for the Prosecution;1957;When Leonard Vole is arrested for the sensational murder of a rich, middle-aged widow, the famous Sir Wilfrid Robarts agrees to appear on his behalf. Sir Wilfrid, recovering from a near-fatal heart attack, is supposed to be on a diet of bland, civil suits—but the lure of the criminal courts is too much for him, especially when the case is so difficult.;https://www.themoviedb.org/t/p/w600_and_h900_bestv2/mM5Cad2ESBprh6ucPnMzMfI34Cu.jpg
Aliens;1986;When Ripley`s lifepod is found by a salvage crew over 50 years later, she finds that terra-formers are on the very planet they found the alien species. When the company sends a family of colonists out to investigate her story—all contact is lost with the planet and colonists. They enlist Ripley and the colonial marines to return and search for answers.;https://www.themoviedb.org/t/p/w600_and_h900_bestv2/r1x5JGpyqZU8PYhbs4UcrO1Xb6x.jpg
Spider-Man: Into the Spider-Verse;2018;"Miles Morales is juggling his life between being a high school student and being a spider-man. When Wilson ""Kingpin"" Fisk uses a super collider, others from across the Spider-Verse are transported to this dimension.";https://www.themoviedb.org/t/p/w600_and_h900_bestv2/iiZZdoQBEYBv6id8su7ImL0oCbD.jpg
American Beauty;1999;Lester Burnham, a depressed suburban father in a mid-life crisis, decides to turn his hectic life around after developing an infatuation with his daughter`s attractive friend.;https://www.themoviedb.org/t/p/w600_and_h900_bestv2/wby9315QzVKdW9BonAefg8jGTTb.jpg
Dr. Strangelove or: How I Learned to Stop Worrying and Love the Bomb;1964;After the insane General Jack D. Ripper initiates a nuclear strike on the Soviet Union, a war room full of politicians, generals and a Russian diplomat all frantically try to stop the nuclear strike.;https://www.themoviedb.org/t/p/w600_and_h900_bestv2/7SixLzxcqezkZEYU8pcHZgbkmjp.jpg
